<?xml version="1.0" encoding="UTF-8"?>
<!-- This XML document will be used for a video game collection -->
<!DOCTYPE collection SYSTEM "./videogames.dtd">
<collection>
    <game id="1">
        <title>Xenoblade Chronicles</title>
        <genre>JRPG</genre>
        <format>Physical</format>
        <price>$55</price>
        <console>Wii</console>
    </game>
    <game id="2">
        <title>Horzion Zero Dawn</title>
        <genre>Action</genre>
        <format>Digital</format>
        <price>$60</price>
        <console>PS4</console>
    </game>
    <game id="3">
        <title>Uncharted</title>
        <genre>Adventure</genre>
        <format>Physical</format>
        <price>$10</price>
        <console>PS3</console>
    </game>
    <game id="4">
        <title>Fallout-1</title>
        <genre>RPG</genre>
        <format>Digital</format>
        <price>$5</price>
        <console>PC</console>
    </game>
</collection>